participantID,wcg_diff_general,wcg_diff_general_group
1614,none really,no_effect
1615,It was a little harder coming up with words to ensure I wasn't writing the exact story I just read.,harder
1666,I felt that my words would be influenced by the story I had just read,lingering
1616,I was able to focus more on coming up with words the first round. Was thinking about the story in the second round,"lingering,harder"
1617,"I didn't think as much about food, i was focused on the story and what was coming up in my mind from the story ",concentrate
1667,I didn't have any differences before or after reading the story that I can think of. ,no_effect
1618,"The first time it was easy to not think about food, but the second time it was hard not thinking of the story. ",harder
