1078,False,True,True,False,2.0,0.5,1.0,7.0,1.0,6.0,7.0,2.0,4.0,5.0,2.0,1.0,4.0,1.0,3.0,6.0,47.0,49.0,38.0,0.5595238095238095,0.5384615384615384,0.5428571428571428,N,7.0,"I try not to think too long as thinking too much makes you stumble and blank out, so I just associate the first or second thing that pops into my mind, and I've been reading the news a lot the past week so I'm sure there's quite an amount of some sad, anxious, kinda depressing themes. This is exactly why I'm trying to read a lot less news and just focus more on my life. But word association is a lot of fun, I wouldn't mind doing more of that. I just tie anything into it that's somewhat relatable. For example, eagle, falcon, they eat small game, but I thought of worms, nutrition, so I just kept rolling with it. ",meaning,meaning,"It's trying to measure your ability to recall a story after experiencing fast-paced stimuli. I'm not exactly sure. This one's kind of a tricky one. I'm sure I'm probably wrong, but even if I'm a little right that would be cool. ","For some reason, it felt like it was harder to come up with words the second time. I don't know if that's related to the story or not. ",5.0,dontknow,"Actually, I treated the exercise almost completely separate from the story, because it's so different. But it was in the back of my mind which I feel like slowed me down a little, and made me stop and pause longer. At the same time, I don't feel like it affected me too much because... Actually, no, yeah, I slowed down, but it wasn't because of the story I don't feel like. I'm not sure exactly. It definitely took up a bit of my brain capacity to reason and think on the fly, be creative. A bit of a distraction at the very least. ",5.0,4.0,5.0,3.0,6.0,5.0,2.0,3.0,"I did feel a little more anxious, a little more agitated, I felt like I'm being rushed more. I also felt like the pauses of empty thinking, empty thoughts, etc. were longer because I could notice a difference in the length of my pauses alone. I'm not sure how much it affected me though, but it did for sure. This is a very interesting study that I haven't really encountered a similar one to. Thank you for the study. ",USA,11:02,30-34,M,Right,Y,,Y,,White,1,N,2,8,N,,6.0,,"This was a very interesting experience. I've long suspected that if you're focusing on something else, or multiple tasks, your critical brain function slows down as you're working with limited capacity. It's like trying to read a technical document at work when you're tired or on low sleep, your brain just doesn't register it the same way, and you might need to reread a few times to memorize it or even understand it well enough.   When we are distracted, it's similar to like being low sleep, in my opinion. I feel like things that grab our attention, our distractions, are usurping away the limited brain function we have. The limited amount of brain ""energy"" we have for that day, you know, it's a limited resource. Anyway, to tie it back with the study, definitely noticed a change after reading the story and doing the word game again. Which is ironic actually, because usually the second time you'd do a game it would become a lot easier.   Thanks again for the study. That was interesting. ",0.0,,1719942065225.0,1719942059861.0,1719942493275.0,1719942119584.0,1719942084991.0,1719942119584.0,1719942056078.0,1719942817299.0,1719943339047.0,1719942866375.0,1719942689126.0,1719943387416.0,1719942750117.0,1719942323785.0,1719942057816.0,1719942084990.0,1719942065225.0,1719942689125.0,1719942323785.0,1719942119583.0,1719942119584.0,1719942057815.0,1719942866374.0,1719943387415.0,1719943339046.0,1719942750116.0,1719943552430.0,1719942817298.0,1719942493275.0,1719942059861.0,19765.0,5364.0,195850.0,204201.0,34592.0,0.0,1737.0,49075.0,48368.0,472671.0,60990.0,165014.0,67181.0,169490.0,2045.0,1719942508429.0,1719942140555.0,1719942422953.0,1719942689125.0,1719942323785.0,1719942493275.0,70322.0,0.5318785860162006,15154.0,5888.0,3936.0,1708.8032779795883,,0.0,0.0,0.0,0.0,21874.0,0.0,0.0,0.0,0.0,0.0,0.0,0.0,0.0,0.0,1914.0,1,0,30000.0
1021,True,True,True,True,4.0,1.0,1.0,7.0,1.0,7.0,7.0,3.0,7.0,5.0,3.0,1.0,7.0,1.0,7.0,7.0,60.0,63.0,46.0,0.7142857142857143,0.6923076923076923,0.6571428571428571,Y,7.0,looking around the room I am in,none,none,I am not sure,no difference,5.0,unintentional,I was trying to think of words but my mind was wandering to the story I just read,7.0,4.0,4.0,4.0,3.0,1.0,1.0,1.0,The story was funny so my emotions were more happy after reading it ,USA,14:50,45-49,F,Right,Y,,Y,,White,1,N,3,8,N,,7.0,,,0.0,,1719776126958.0,1719776119685.0,1719776451463.0,1719776158799.0,1719776134474.0,1719776144097.0,1719776117240.0,1719776784447.0,1719777026742.0,1719776814330.0,1719776653568.0,1719777095088.0,1719776729478.0,1719776376599.0,1719776117464.0,1719776134472.0,1719776126956.0,1719776653567.0,1719776376599.0,1719776144096.0,1719776158798.0,1719776117463.0,1719776814329.0,1719777095085.0,1719777026739.0,1719776729476.0,1719777106243.0,1719776784445.0,1719776451463.0,1719776119684.0,7514.0,7271.0,202104.0,217800.0,9622.0,14701.0,223.0,29882.0,68343.0,212409.0,75908.0,11155.0,54967.0,74864.0,2220.0,1719776471220.0,1719776195722.0,1719776386735.0,1719776653567.0,1719776376598.0,1719776451463.0,64728.0,0.8995445152524878,19757.0,11984.0,10258.0,3475.1772959183672,,0.0,0.0,0.0,0.0,0.0,0.0,0.0,0.0,0.0,0.0,0.0,0.0,0.0,0.0,0.0,1,0,10146.0
1058,True,True,True,False,3.0,0.75,1.0,6.0,7.0,5.0,6.0,6.0,6.0,5.0,5.0,6.0,5.0,6.0,7.0,5.0,69.0,75.0,57.0,0.8214285714285714,0.8241758241758241,0.8142857142857143,N,5.0,I typed the word of things around me.,equal,equal,the creative ability of the participants,I used some of the words on the story in the second word game.,4.0,intentional,I kept imagining the stress the protagonist went through throughout my time playing the word game.,5.0,6.0,4.0,4.0,4.0,4.0,3.0,5.0,I kept replying the scenario in my mind.,USA,09:27,35-39,M,Right,Y,,Y,,Black,1,N,5,8,N,,,,,0.0,,1719842891775.0,1719842876563.0,1719843197633.0,1719842928638.0,1719842899649.0,1719842913189.0,1719842856510.0,1719843606209.0,1719843980205.0,1719843641859.0,1719843386470.0,1719844117152.0,1719843561780.0,1719843128321.0,1719842860377.0,1719842899648.0,1719842891774.0,1719843386469.0,1719843128321.0,1719842913188.0,1719842928636.0,1719842860376.0,1719843641858.0,1719844117151.0,1719843980184.0,1719843561779.0,1719844130463.0,1719843606208.0,1719843197632.0,1719842876563.0,7873.0,15211.0,188836.0,199683.0,13539.0,15447.0,3866.0,35649.0,136946.0,338325.0,175309.0,13311.0,44428.0,69311.0,16186.0,1719843206254.0,1719842947615.0,1719843141168.0,1719843386469.0,1719843128321.0,1719843197632.0,56464.0,0.5636076684019629,8622.0,15235.0,14436.0,4134.470833333333,,0.0,0.0,0.0,0.0,0.0,0.0,0.0,0.0,0.0,0.0,0.0,0.0,0.0,0.0,6248.0,1,0,9734.0
1059,True,False,True,True,3.0,0.75,1.0,7.0,1.0,7.0,7.0,4.0,7.0,6.0,7.0,5.0,5.0,4.0,5.0,6.0,67.0,71.0,56.0,0.7976190476190477,0.7802197802197802,0.8,N,7.0,"Before the story I was going with whatever words the came to mind, but with no real theme. After the story I did the same thing, but with the impression the story gave me, but that started falling apart after a while so I just went back to writing down random words that came to mind.",none,none,How stories can impact what we're thinking and how we think things.,"Like I said, before I was just coming up with random words and writing them down with no rhyme or reason. After the story I wanted to stick with the vibe I thought the story was going to go with (I thought it was going to be a scary story) until it got harder to come up with words so then I went back to my original approach of writing down words as they came to mind.",7.0,intentional,"Like I said, before the story was revealed as something mundane (like a lights-switch being set to dim) I was expecting something scary to happen so I was in that mindset while I played the second word chain game.",7.0,2.0,6.0,7.0,7.0,4.0,1.0,5.0,First round I was just having fun with no rules when it came to the word chain game. The second round I wanted to challenge myself to stick to a theme (and I manage to for the most part) until it got too hard to stick to it (especially since I wanted to keep my word count up for second round compared to first).,USA,10:24,30-34,M,Right,Y,,Y,,White,1,N,3,10,N,,7.0,,I thought this was a very enjoyable and easy to understand survey to take.,0.0,,1719842404471.0,1719842397269.0,1719842727978.0,1719842435001.0,1719842410387.0,1719842417439.0,1719842395103.0,1719843185470.0,1719843823420.0,1719843235635.0,1719842925802.0,1719843902188.0,1719843096049.0,1719842639621.0,1719842395184.0,1719842410386.0,1719842404471.0,1719842925801.0,1719842639621.0,1719842417439.0,1719842435001.0,1719842395183.0,1719843235634.0,1719843902186.0,1719843823417.0,1719843096048.0,1719843966625.0,1719843185468.0,1719842727977.0,1719842397268.0,5915.0,7202.0,197823.0,204620.0,7052.0,17562.0,80.0,50164.0,78766.0,587782.0,170246.0,64437.0,89419.0,88356.0,2084.0,1719842739685.0,1719842456808.0,1719842657991.0,1719842925801.0,1719842639620.0,1719842727977.0,69986.0,0.716440303076169,11708.0,9208.0,9208.0,3275.1489262371615,,0.0,0.0,0.0,0.0,0.0,0.0,0.0,0.0,3996.0,0.0,0.0,0.0,0.0,0.0,0.0,1,0,9998.0
1022,True,True,True,False,3.0,0.75,1.0,7.0,1.0,7.0,6.0,3.0,4.0,1.0,4.0,3.0,4.0,1.0,5.0,6.0,49.0,52.0,38.0,0.5833333333333334,0.5714285714285714,0.5428571428571428,N,4.0,looking around my room and out my window and thinking of items in my house,meaning,meaning,keywords or what people pay attention to in a story ,it felt easier and i think i reused words from the first time,4.0,unintentional,I think i started with words from the story. I think just because they were easy to think of already in my head but i dont really remember ,5.0,2.0,3.0,3.0,4.0,3.0,3.0,4.0,I just felt like it was easier the second time because I had already thought of words and was thinking of the words in the story,USA,15:36,25-29,M,Right,Y,,Y,,White,1,N,4,1,N,,7.0,,none thakn you,0.0,,1719775319234.0,1719775313967.0,1719775672952.0,1719775400227.0,1719775323462.0,1719775330362.0,1719775312450.0,1719775959723.0,1719776210184.0,1719775990544.0,1719775862260.0,1719776254327.0,1719775906231.0,1719775612099.0,1719775312548.0,1719775323460.0,1719775319232.0,1719775862257.0,1719775612099.0,1719775330360.0,1719775400226.0,1719775312547.0,1719775990542.0,1719776254325.0,1719776210180.0,1719775906229.0,1719776274069.0,1719775959720.0,1719775672951.0,1719775313965.0,4226.0,5265.0,189305.0,211872.0,6898.0,69864.0,97.0,30819.0,44141.0,219636.0,43969.0,19742.0,53489.0,60852.0,1417.0,1719775681685.0,1719775427914.0,1719775623771.0,1719775862256.0,1719775612098.0,1719775672951.0,49180.0,0.8019980568118094,8734.0,9080.0,9080.0,2558.566869599372,,0.0,0.0,0.0,0.0,0.0,0.0,0.0,0.0,0.0,0.0,0.0,0.0,0.0,0.0,0.0,1,0,8241.0
1023,True,True,True,False,3.0,0.75,1.0,7.0,1.0,7.0,6.0,5.0,3.0,3.0,5.0,1.0,5.0,1.0,5.0,6.0,50.0,55.0,39.0,0.5952380952380952,0.6043956043956044,0.5571428571428572,N,6.0,Just let my mind go,none,none,Train of thought,Started focused on the story for round 2,5.0,unintentional,"I started off still thinking of the light, so my responses initially reflected that.",6.0,3.0,3.0,6.0,6.0,2.0,3.0,2.0,"I didn't really feel any changes, I was pretty locked in to the word game.",USA,12:47,25-29,F,Right,Y,,Y,,White,1,N,4,6,N,,7.0,,,0.0,,1719776230104.0,1719776227825.0,1719776471535.0,1719776242421.0,1719776233192.0,1719776237424.0,1719776226496.0,1719776720195.0,1719776832878.0,1719776737648.0,1719776661279.0,1719776874381.0,1719776693281.0,1719776430871.0,1719776226806.0,1719776233190.0,1719776230103.0,1719776661277.0,1719776430870.0,1719776237423.0,1719776242419.0,1719776226805.0,1719776737647.0,1719776874379.0,1719776832871.0,1719776693279.0,1719776878648.0,1719776720193.0,1719776471535.0,1719776227824.0,3086.0,2278.0,189742.0,188449.0,4231.0,4995.0,309.0,17452.0,41501.0,95223.0,32000.0,4267.0,26912.0,40664.0,1018.0,1719776477858.0,1719776250140.0,1719776450306.0,1719776661277.0,1719776430870.0,1719776471535.0,21229.0,0.8949556086909866,6323.0,6876.0,4940.0,2427.0466666666666,,0.0,0.0,0.0,0.0,0.0,0.0,0.0,0.0,0.0,0.0,0.0,0.0,0.0,0.0,0.0,1,0,3909.0
1060,True,True,True,False,3.0,0.75,1.0,7.0,6.0,7.0,7.0,5.0,6.0,4.0,6.0,3.0,6.0,1.0,2.0,6.0,61.0,66.0,53.0,0.7261904761904762,0.7252747252747253,0.7571428571428571,N,5.0,Stream of consciousness effected by my surroundings.,equal,equal,How reading a story effects cognition.,I had more ideas for words.,3.0,dontknow,The story wasn't consciously on my mind.,4.0,2.0,2.0,2.0,5.0,2.0,3.0,4.0,I found it easier to come up with words.,USA,09:57,25-29,M,Right,Y,,Y,,White,1,N,2,8,N,,6.0,,,0.0,,1719841207949.0,1719841204077.0,1719841603180.0,1719841332218.0,1719841311401.0,1719841319938.0,1719841202139.0,1719841926577.0,1719842234070.0,1719841964372.0,1719841803671.0,1719842297923.0,1719841869079.0,1719841530274.0,1719841202230.0,1719841311400.0,1719841207948.0,1719841803670.0,1719841530273.0,1719841319938.0,1719841332218.0,1719841202229.0,1719841964371.0,1719842297922.0,1719842234068.0,1719841869078.0,1719842373595.0,1719841926576.0,1719841603179.0,1719841204076.0,103451.0,3871.0,200490.0,198055.0,8537.0,12280.0,90.0,37794.0,63852.0,269696.0,65407.0,75672.0,57497.0,72905.0,1846.0,1719841618312.0,1719841346718.0,1719841552536.0,1719841803670.0,1719841530273.0,1719841603179.0,50643.0,0.5049998472037076,15133.0,17086.0,12170.0,4036.4743697478993,,20607.0,0.0,0.0,0.0,0.0,0.0,0.0,0.0,0.0,0.0,0.0,0.0,0.0,0.0,0.0,1,0,6932.0
1061,True,True,True,True,4.0,1.0,1.0,7.0,2.0,7.0,7.0,4.0,7.0,1.0,4.0,7.0,5.0,1.0,7.0,7.0,62.0,66.0,48.0,0.7380952380952381,0.7252747252747253,0.6857142857142857,N,4.0,just letting my mind go blank and letting the words come,none,none,to see how the word game affected memory for the story,none,5.0,neither,"i did not think about the story at all, during the word game i tried to think of the words only. I let my mind go blank and other than worrying  about spelling did not think of anything else",1.0,1.0,1.0,1.0,4.0,1.0,1.0,1.0,"again i did not feel any changes really, i was just trying to go blank and let them come to me. if i did feel any difficulty i tried to put it out of mind and let it go blank again",USA,06:57,35-39,M,Right,Y,,Y,,White,1,N,3,8,N,,7.0,,,0.0,,1719841358264.0,1719841353043.0,1719841633628.0,1719841381467.0,1719841364512.0,1719841370056.0,1719841351554.0,1719841930865.0,1719842206964.0,1719841954616.0,1719841835508.0,1719842269315.0,1719841886733.0,1719841583216.0,1719841351727.0,1719841364507.0,1719841358261.0,1719841835504.0,1719841583215.0,1719841370052.0,1719841381465.0,1719841351725.0,1719841954610.0,1719842269310.0,1719842206959.0,1719841886727.0,1719842281648.0,1719841930859.0,1719841633627.0,1719841353040.0,6243.0,5218.0,201876.0,201748.0,5540.0,11409.0,171.0,23745.0,62346.0,252343.0,51219.0,12333.0,44126.0,50411.0,1313.0,1719841653569.0,1719841401846.0,1719841594474.0,1719841835503.0,1719841583213.0,1719841633627.0,39153.0,0.9041136487531073,19942.0,9247.0,7054.0,3497.1970370370373,,0.0,0.0,0.0,0.0,0.0,0.0,0.0,0.0,0.0,0.0,0.0,0.0,0.0,0.0,0.0,1,0,5942.0
1062,True,True,True,True,4.0,1.0,1.0,7.0,1.0,7.0,7.0,5.0,7.0,4.0,7.0,1.0,5.0,3.0,7.0,7.0,63.0,68.0,49.0,0.75,0.7472527472527473,0.7,N,7.0,"opposites, relevant words, things in my life",equal,equal,how are minds associate words with other words,i felt like the second round made me want to tell a story more than the first round.,5.0,neither,"i remembered the story while playing the game, but I don't feel it came into play while playing the game. i tried to continue to think of random associations while playing. the story was at the back of my mind as just a funny story. ",4.0,1.0,1.0,4.0,4.0,1.0,1.0,1.0,playing the first round and second round felt about the same. i picked a random word and thought of life associations or a rhyming word. mostly I focused on opposites. ,USA,08:55,30-34,F,Right,Y,,Y,,White,1,N,4,10,N,,7.0,,,0.0,,1719841306134.0,1719841302891.0,1719841569297.0,1719841331161.0,1719841316031.0,1719841324030.0,1719841301589.0,1719841848315.0,1719842111903.0,1719841867592.0,1719841760619.0,1719842149904.0,1719841810758.0,1719841531053.0,1719841301756.0,1719841316030.0,1719841306133.0,1719841760617.0,1719841531052.0,1719841324029.0,1719841331160.0,1719841301755.0,1719841867590.0,1719842149900.0,1719842111899.0,1719841810757.0,1719842157998.0,1719841848312.0,1719841569296.0,1719841302889.0,9896.0,3242.0,191320.0,199891.0,7998.0,7130.0,166.0,19275.0,37997.0,244307.0,50138.0,8094.0,37554.0,38243.0,1133.0,1719841579713.0,1719841340281.0,1719841539281.0,1719841760617.0,1719841531051.0,1719841569296.0,30015.0,0.7724961194809794,10417.0,18568.0,8646.0,3392.837201591512,,0.0,0.0,0.0,0.0,0.0,0.0,0.0,0.0,0.0,0.0,0.0,0.0,0.0,0.0,0.0,1,0,3996.0
1079,True,True,True,False,3.0,0.75,1.0,6.0,1.0,6.0,7.0,6.0,4.0,5.0,6.0,2.0,5.0,1.0,6.0,7.0,56.0,62.0,43.0,0.6666666666666666,0.6813186813186813,0.6142857142857143,N,6.0,I just used the next word which I associated with the previous,meaning,meaning,Retention of material after being subjected to a mentally stimulating exercise.,It took me a bit longer to come up with word associations,2.0,unintentional,I think that I had an image of a lightbulb a couple of times,3.0,1.0,2.0,4.0,5.0,4.0,1.0,4.0,I think that the retention of the story was somewhere in the back of my mind. This may have made it more difficult to make word associations during the second round.,USA,11:00,45-49,M,Right,Y,,Y,,White,1,N,3,9,N,,7.0,,,0.0,,1719941865186.0,1719941859468.0,1719942436649.0,1719942148426.0,1719941979131.0,1719941988358.0,1719941857446.0,1719942785627.0,1719943136144.0,1719942816255.0,1719942641456.0,1719943185643.0,1719942727813.0,1719942354931.0,1719941857578.0,1719941979130.0,1719941865186.0,1719942641455.0,1719942354930.0,1719941988358.0,1719942148426.0,1719941857577.0,1719942816255.0,1719943185642.0,1719943136142.0,1719942727812.0,1719943203443.0,1719942785627.0,1719942436649.0,1719941859467.0,113944.0,5718.0,204806.0,206504.0,9227.0,160068.0,131.0,30628.0,49498.0,319887.0,86356.0,17800.0,57814.0,81718.0,1889.0,1719942455767.0,1719942171164.0,1719942371815.0,1719942641455.0,1719942354930.0,1719942436649.0,64834.0,0.8268096596070529,19118.0,13032.0,11575.0,5436.580086580087,,0.0,0.0,0.0,0.0,0.0,0.0,0.0,0.0,0.0,0.0,0.0,0.0,0.0,0.0,0.0,1,0,7170.0
1063,True,False,True,True,3.0,0.75,1.0,4.0,5.0,5.0,3.0,4.0,3.0,4.0,4.0,4.0,4.0,4.0,5.0,4.0,49.0,53.0,40.0,0.5833333333333334,0.5824175824175825,0.5714285714285714,Y,4.0,nothing,equal,sound,nothing,nothing,4.0,intentional,nothing,4.0,3.0,4.0,5.0,3.0,5.0,4.0,3.0,nothing,USA,23:19,45-49,F,Right,Y,,Y,,Black,1,N,4,4,Y,nothing,5.0,,,0.0,,1719846408024.0,1719846406199.0,1719846684365.0,1719846429409.0,1719846424022.0,1719846429409.0,1719846400039.0,1719847077127.0,1719847178913.0,1719847104943.0,1719846872572.0,1719847230674.0,1719847028322.0,1719846615231.0,1719846400799.0,1719846424021.0,1719846408022.0,1719846872570.0,1719846615230.0,1719846429408.0,1719846429409.0,1719846400795.0,1719847104941.0,1719847230672.0,1719847178909.0,1719847028320.0,1719847246843.0,1719847077125.0,1719846684364.0,1719846406198.0,15997.0,1823.0,188205.0,185821.0,5386.0,0.0,756.0,27814.0,51759.0,73966.0,155748.0,16169.0,48803.0,69133.0,5399.0,1719846692428.0,1719846432941.0,1719846652329.0,1719846872570.0,1719846615229.0,1719846684364.0,32035.0,-0.30434185289505616,8064.0,66877.0,66877.0,11750.93117408907,,10827.0,0.0,0.0,0.0,0.0,0.0,0.0,0.0,0.0,0.0,0.0,0.0,0.0,0.0,0.0,1,0,8480.0
1080,False,True,True,False,2.0,0.5,1.0,5.0,2.0,7.0,6.0,4.0,5.0,1.0,7.0,4.0,5.0,1.0,7.0,7.0,57.0,61.0,43.0,0.6785714285714286,0.6703296703296703,0.6142857142857143,N,7.0,pick a simple word and build off of it ,sound,sound,how much you can remember the story after the word play game ,it was the same for me ,4.0,intentional,it was harder to do the game because i knew had to remember the story just in case there were questions ,7.0,7.0,4.0,5.0,7.0,7.0,5.0,5.0,i noticed the game was harder when you have to remember the story ,USA,00:53,30-34,M,Right,Y,,Y,,White,1,N,1,4,N,,7.0,,,0.0,,1719941581584.0,1719941577013.0,1719941971391.0,1719941619220.0,1719941597795.0,1719941605697.0,1719941575473.0,1719942379470.0,1719942788181.0,1719942434472.0,1719942200454.0,1719942886923.0,1719942276037.0,1719941851525.0,1719941575623.0,1719941597789.0,1719941581581.0,1719942200447.0,1719941851522.0,1719941605693.0,1719941619218.0,1719941575622.0,1719942434467.0,1719942886918.0,1719942788169.0,1719942276031.0,1719942923296.0,1719942379462.0,1719941971390.0,1719941577010.0,16205.0,4568.0,229056.0,232302.0,7898.0,13521.0,149.0,54997.0,98737.0,353697.0,75577.0,36373.0,103425.0,119865.0,1387.0,1719942012130.0,1719941660587.0,1719941886102.0,1719942200447.0,1719941851519.0,1719941971390.0,85288.0,0.9212587834483742,40740.0,36638.0,32494.0,10033.154891304348,,0.0,0.0,0.0,0.0,0.0,0.0,0.0,0.0,0.0,0.0,0.0,0.0,0.0,0.0,0.0,1,0,10769.0
1024,True,True,True,False,3.0,0.75,1.0,7.0,4.0,6.0,5.0,3.0,1.0,1.0,1.0,1.0,4.0,1.0,1.0,4.0,36.0,39.0,31.0,0.42857142857142855,0.42857142857142855,0.44285714285714284,N,1.0,"My only strategy was word association. If I thought of a word, there was normally a related word that would come to mind, so I would write that next.",meaning,meaning,I would expect it is attempting to measure how we associate words together and whether hearing a story impacts those word associations.,I started the second word chain game with words related to the story rather than a  random word that came to mind in the first study.,7.0,unintentional,"After reading the story, when I was asked to think of a word, the first word that came to mind was one related to the story as it was the most recent thing in my mind.",7.0,1.0,1.0,7.0,4.0,1.0,1.0,1.0,"The only real change that I noticed was that my focus in the second word chain game was on the story at the start. As additional associations were made, my thoughts clearly diverged from the story. While related to the story, it was easy to come up with additional words. Once my thoughts diverged, there were more gaps where a word didn't immediately come to mind.",USA,14:32,30-34,M,Left,Y,,Y,,White,1,N,4,4,N,,7.0,,,0.0,,1719774930367.0,1719774923913.0,1719775247166.0,1719774977845.0,1719774962583.0,1719774968340.0,1719774922279.0,1719775546357.0,1719775915693.0,1719775581473.0,1719775445719.0,1719775966821.0,1719775486463.0,1719775174252.0,1719774922440.0,1719774962582.0,1719774930366.0,1719775445717.0,1719775174251.0,1719774968340.0,1719774977844.0,1719774922437.0,1719775581472.0,1719775966820.0,1719775915670.0,1719775486462.0,1719775981304.0,1719775546356.0,1719775247165.0,1719774923912.0,32215.0,6453.0,198551.0,196406.0,5757.0,9504.0,158.0,35115.0,51127.0,334197.0,40743.0,14483.0,59893.0,72913.0,1472.0,1719775264128.0,1719774991377.0,1719775194470.0,1719775445717.0,1719775174251.0,1719775247165.0,52695.0,0.8245533733241798,16963.0,10764.0,10620.0,3197.5929802955666,,2885.0,0.0,0.0,0.0,0.0,0.0,0.0,0.0,0.0,0.0,0.0,0.0,0.0,0.0,0.0,1,0,7902.0
1064,True,True,True,False,3.0,0.75,1.0,7.0,1.0,6.0,7.0,3.0,7.0,1.0,6.0,2.0,2.0,1.0,4.0,7.0,51.0,54.0,40.0,0.6071428571428571,0.5934065934065934,0.5714285714285714,N,6.0,I was typing words that vaguely associated with each other in my mind the first round. The second round was the same strategy with the addition of words from the story and related thoughts.,meaning,meaning,"This experiment is trying to measure the strength of word associations, I think.","Before reading the story, I started with words related to sounds outside my house. After the story, I started with words from the story.",6.0,both,"After reading the story, I was intentionally reflecting on the words from the story, then typing the first word that I associated with the previous one. Some words from the story came back to me unintentionally throughout the game.",6.0,4.0,2.0,6.0,3.0,1.0,1.0,2.0,I remembered key words and themes from the story while playing the game the second time. This was different than the first time because I did not have an established theme or story to draw from initially.,USA,10:25,40-44,M,Right,Y,,Y,,White,1,N,2,10,N,,7.0,,"This was an interesting study and the game was pretty fun. The story was also funny, which made it more memorable to me.",0.0,,1719842841869.0,1719842836778.0,1719843176355.0,1719842911038.0,1719842880888.0,1719842900747.0,1719842833942.0,1719843503230.0,1719843926887.0,1719843532504.0,1719843373699.0,1719843980271.0,1719843431749.0,1719843113969.0,1719842834009.0,1719842880885.0,1719842841866.0,1719843373697.0,1719843113968.0,1719842900745.0,1719842911036.0,1719842834009.0,1719843532502.0,1719843980268.0,1719843926884.0,1719843431746.0,1719844041273.0,1719843503227.0,1719843176354.0,1719842836775.0,39016.0,5088.0,197342.0,202930.0,19857.0,10289.0,67.0,29272.0,53381.0,394380.0,58047.0,61002.0,71478.0,62385.0,2766.0,1719843193103.0,1719842927868.0,1719843128170.0,1719843373696.0,1719843113968.0,1719843176354.0,48184.0,0.7603892291026287,16749.0,7824.0,6120.0,3217.8684129429894,,6957.0,0.0,0.0,0.0,0.0,0.0,0.0,0.0,0.0,0.0,0.0,0.0,0.0,0.0,0.0,1,0,4526.0
