1073,False,True,True,True,3.0,0.75,1.0,6.0,2.0,6.0,7.0,6.0,2.0,4.0,1.0,2.0,3.0,1.0,3.0,5.0,42.0,48.0,34.0,0.5,0.5274725274725275,0.4857142857142857,N,2.0,"things are me, random categories",none,none,NO CLUE LOL!!!,slightly easier the second time after chuckling at the silly story ,2.0,neither,i completely forgot about the story and went back to the word challenge but maybe went slower and not as competitive ,2.0,1.0,2.0,2.0,1.0,1.0,2.0,1.0,slightly more at ease and less competitive about the word challenge,USA,14:06,35-39,F,Right,Y,,Y,,White,1,N,2,4,N,,6.0,,,0.0,,1719941942750.0,1719941937612.0,1719942863625.0,1719942581224.0,1719941954392.0,1719941961980.0,1719941933509.0,1719943288817.0,1719943561678.0,1719943320422.0,1719943064520.0,1719943617735.0,1719943183506.0,1719942781640.0,1719941933607.0,1719941954391.0,1719941942749.0,1719943064520.0,1719942781639.0,1719941961979.0,1719942581223.0,1719941933606.0,1719943320420.0,1719943617734.0,1719943561677.0,1719943183505.0,1719943636747.0,1719943288816.0,1719942863625.0,1719941937611.0,11641.0,5137.0,200895.0,200415.0,7587.0,619243.0,97.0,31603.0,56056.0,241255.0,118985.0,19012.0,105310.0,81985.0,4004.0,1719942884142.0,1719942600288.0,1719942801965.0,1719943064519.0,1719942781639.0,1719942863625.0,61660.0,0.7776882511508454,20517.0,10175.0,7664.0,2914.6007742257743,,0.0,0.0,0.0,0.0,0.0,0.0,0.0,0.0,0.0,0.0,0.0,0.0,0.0,0.0,0.0,1,0,7904.0
1040,True,True,False,False,2.0,0.5,1.0,7.0,7.0,6.0,5.0,6.0,7.0,4.0,6.0,3.0,7.0,3.0,5.0,7.0,67.0,73.0,55.0,0.7976190476190477,0.8021978021978022,0.7857142857142857,N,7.0,Associating words and ideas that came to mind.,meaning,equal,similar ideas and idea chaining?,"I attempted to use longer words and try not to have them completely associate with the other words used,",5.0,both,"the story lingered in my mind, which allowed me to think of additional words.",6.0,3.0,5.0,5.0,7.0,4.0,4.0,4.0, I started to use words associated with the story.,USA,06:50,35-39,M,Right,Y,,Y,,Black,1,Y,4,8,N,,7.0,,,33130.0,,1719841001493.0,1719840999446.0,1719841256912.0,1719841019103.0,1719841006832.0,1719841014100.0,1719840998204.0,1719841577870.0,1719841780071.0,1719841602602.0,1719841486795.0,1719841863917.0,1719841536769.0,1719841213054.0,1719840998380.0,1719841006831.0,1719841001492.0,1719841486794.0,1719841213054.0,1719841014100.0,1719841019102.0,1719840998380.0,1719841602601.0,1719841863916.0,1719841780069.0,1719841536768.0,1719841878245.0,1719841577869.0,1719841256912.0,1719840999445.0,5338.0,2046.0,229882.0,193951.0,7268.0,5002.0,176.0,24731.0,83845.0,177467.0,49973.0,14328.0,41100.0,43858.0,1065.0,1719841306334.0,1719841030357.0,1719841228326.0,1719841486794.0,1719841213053.0,1719841256912.0,28586.0,0.7197351692464372,49422.0,10767.0,10767.0,2885.1761664564942,,0.0,0.0,32487.0,0.0,0.0,0.0,0.0,0.0,8608.0,0.0,0.0,0.0,0.0,643.0,0.0,1,2,4178.0
1074,False,True,True,False,2.0,0.5,1.0,5.0,1.0,5.0,7.0,4.0,1.0,1.0,1.0,2.0,2.0,1.0,1.0,5.0,32.0,36.0,26.0,0.38095238095238093,0.3956043956043956,0.37142857142857144,N,3.0,"I basically just free associated and typed the first thing that came through my head. I tried not to think much about it and generally left less than a second between words, if possible. If I misspelled something, I attempted to correct the spelling. Occasionally, I hit a certain topic and it became a bit of a list that I went through. And I definitely started the second word chain with words that resonated from the story.",meaning,meaning,"I would guess it's measuring the effect of the story on the words we come up with. Perhaps it's expected that the words in the second chain would be darker than the words in the first chain. I noticed that my second chain was influenced by the story at first, but after a moment, I was back in the same basic head space I was during the first chain. Maybe that's some sort of metric of attention span.","I don't think I felt differently at all. The first words I came up with in the second chain definitely arose from the story, but I didn't feel much emotion during either word chain game. I found it sort of fun to associate words, so I enjoyed the game, but I don't think my mood was markedly different during the second chain. ",3.0,intentional,"Both, I guess. I definitely was aware of the story at the beginning of the chain. I used it as a jumping off point. But from there, I followed the same process I did the first time, so any lingering effects of the story would be unintentional.",3.0,1.0,1.0,4.0,1.0,1.0,1.0,1.0,"I truly did not experience notable changes. The two chains just felt like discrete instances of the same activity. I expect I would feel the same now if I were to do a third chain. I tried not to overthink it and to allow it to happen naturally, and I would do the same again.",USA,13:55,30-34,NEITHER,Left,Y,,Y,,White,1,N,4,5,N,,7.0,,"I am neurodivergent (ADHD and autism), so I don't know if that is a confounding factor at all. ",0.0,,1719941598014.0,1719941595545.0,1719942008851.0,1719941746230.0,1719941716331.0,1719941732056.0,1719941590235.0,1719942296133.0,1719942921224.0,1719942323446.0,1719942202111.0,1719942986852.0,1719942241875.0,1719941943852.0,1719941590404.0,1719941716327.0,1719941598013.0,1719942202107.0,1719941943851.0,1719941732053.0,1719941746228.0,1719941590403.0,1719942323442.0,1719942986850.0,1719942921214.0,1719942241873.0,1719943051762.0,1719942296128.0,1719942008850.0,1719941595541.0,118313.0,2468.0,193256.0,197621.0,15722.0,14172.0,168.0,27309.0,65626.0,597768.0,39762.0,64910.0,54253.0,64998.0,5137.0,1719942021357.0,1719941763648.0,1719941954930.0,1719942202106.0,1719941943849.0,1719942008850.0,53920.0,0.7621385086687662,12507.0,7512.0,7168.0,2160.7149928263984,,0.0,0.0,0.0,0.0,0.0,0.0,0.0,0.0,6180.0,0.0,0.0,0.0,0.0,0.0,1309.0,1,0,8058.0
1041,True,True,True,True,4.0,1.0,1.0,7.0,1.0,7.0,7.0,5.0,7.0,1.0,3.0,1.0,2.0,1.0,7.0,7.0,51.0,56.0,37.0,0.6071428571428571,0.6153846153846154,0.5285714285714286,N,6.0,"I mostly thought about items in my house and outside around my neighborhood at first, but then allowed my mind to wander a bit and then just began typing whatever came into my mind. ",none,none,I believe you are measuring ability to remember key details in reading especially after typing a wide variety of many different and unrelated words.,"It felt the same to me both times, essentially.",2.0,neither,"I feel that I was able to set aside the story and return to the task, approaching it as I did in the first round. I do not recall my reflecting on the story at all during the second round.",1.0,1.0,1.0,1.0,1.0,1.0,1.0,1.0,"I did not experienced any real changes between reading the story and playing the second round of the game. Since I had already played one round of the game, I felt I was able to return to it with the same approach as the first time. This allowed me to get back to my original task without the story entering my mind at all.",USA,09:05,50-54,M,Right,Y,,Y,,White,1,N,4,8,N,,7.0,,This was very fun and interesting. Thanks!,0.0,,1719841569155.0,1719841558389.0,1719841937636.0,1719841615087.0,1719841580271.0,1719841604087.0,1719841555380.0,1719842343920.0,1719842669296.0,1719842370087.0,1719842136304.0,1719842729863.0,1719842264358.0,1719841821516.0,1719841555467.0,1719841580269.0,1719841569153.0,1719842136302.0,1719841821515.0,1719841604086.0,1719841615086.0,1719841555465.0,1719842370086.0,1719842729861.0,1719842669294.0,1719842264355.0,1719842751660.0,1719842343919.0,1719841937635.0,1719841558388.0,11114.0,10764.0,198666.0,206428.0,23815.0,10999.0,85.0,26166.0,60565.0,299207.0,128051.0,21797.0,79561.0,116119.0,2921.0,1719841955895.0,1719841637971.0,1719841833997.0,1719842136302.0,1719841821514.0,1719841937635.0,103638.0,0.8958938374597147,18260.0,12019.0,8707.0,4857.496794871796,,0.0,0.0,0.0,0.0,0.0,0.0,0.0,0.0,0.0,0.0,0.0,0.0,0.0,0.0,0.0,1,0,13274.0
1042,True,True,True,False,3.0,0.75,1.0,7.0,7.0,7.0,7.0,1.0,7.0,6.0,6.0,1.0,6.0,5.0,6.0,6.0,71.0,72.0,59.0,0.8452380952380952,0.7912087912087912,0.8428571428571429,N,7.0,Series and sequences of words that came to my head,equal,equal,The experiment is trying to measure reading and words memory abilities ,I got so many ideas to write more words ,7.0,intentional,I experienced me being in the scenario itself ,7.0,7.0,2.0,2.0,7.0,2.0,1.0,1.0,"There was no changes in my emotions, i was totally attentive and into the study",USA,07:27,25-29,M,Right,Y,,Y,,White,1,N,5,9,N,,7.0,,,0.0,,1719842071106.0,1719842042546.0,1719843234265.0,1719842401401.0,1719842113191.0,1719842384224.0,1719841987709.0,1719843654142.0,1719844029662.0,1719843738485.0,1719843469787.0,1719844121159.0,1719843589443.0,1719843115674.0,1719841988263.0,1719842113189.0,1719842071103.0,1719843469785.0,1719843115673.0,1719842384221.0,1719842401400.0,1719841988256.0,1719843738483.0,1719844121155.0,1719844029659.0,1719843589440.0,1719844149788.0,1719843654140.0,1719843234264.0,1719842042544.0,42083.0,28557.0,235520.0,714272.0,271030.0,17176.0,547.0,84341.0,91493.0,291174.0,119653.0,28629.0,64697.0,118590.0,54281.0,1719843284052.0,1719842933126.0,1719843151757.0,1719843469785.0,1719843115673.0,1719843234264.0,82507.0,0.8149416262168039,49788.0,12459.0,12459.0,3852.8418300653593,,0.0,2056.0,0.0,0.0,6666.0,0.0,0.0,0.0,0.0,0.0,0.0,0.0,0.0,0.0,1973.0,1,0,26039.0
1043,True,True,True,True,4.0,1.0,1.0,7.0,2.0,7.0,7.0,4.0,6.0,4.0,4.0,2.0,5.0,2.0,5.0,6.0,57.0,61.0,46.0,0.6785714285714286,0.6703296703296703,0.6571428571428571,N,6.0,Looked around at objects in the room I was in,none,none,"I actually have no idea, I apologize.","I was still laughing from the story when starting the second round, so I was in a better mood.",7.0,both,"I was laughing, because the story was very relatable.",7.0,3.0,7.0,5.0,5.0,3.0,5.0,4.0,I was definitely in a sillier mood after reading the story and it affected my word choices.,USA,09:54,50-54,F,Right,Y,,Y,,White,1,N,4,4,N,,7.0,,,0.0,,1719841003372.0,1719840998850.0,1719841373315.0,1719841064584.0,1719841037325.0,1719841048594.0,1719840997370.0,1719841713846.0,1719841985317.0,1719841750548.0,1719841570339.0,1719842055016.0,1719841666225.0,1719841278233.0,1719840997487.0,1719841037323.0,1719841003371.0,1719841570336.0,1719841278232.0,1719841048593.0,1719841064583.0,1719840997486.0,1719841750546.0,1719842055014.0,1719841985312.0,1719841666223.0,1719842070654.0,1719841713844.0,1719841373315.0,1719840998849.0,33951.0,4521.0,197021.0,213648.0,11268.0,15989.0,116.0,36700.0,69697.0,234764.0,95884.0,15638.0,47619.0,95082.0,1362.0,1719841387263.0,1719841097964.0,1719841290715.0,1719841570336.0,1719841278232.0,1719841373315.0,82600.0,0.6800786288652603,13948.0,10328.0,10328.0,3671.7604166666665,,0.0,0.0,0.0,0.0,0.0,0.0,0.0,0.0,0.0,0.0,0.0,0.0,0.0,0.0,0.0,1,0,9232.0
1012,True,False,True,False,2.0,0.5,1.0,7.0,1.0,7.0,7.0,6.0,6.0,2.0,1.0,1.0,4.0,1.0,5.0,4.0,46.0,52.0,37.0,0.5476190476190477,0.5714285714285714,0.5285714285714286,N,6.0,none just what came to mind ,none,none,effects of the story on the word game afterward ,the story provided words for the game but did not appeal to my word selection ,2.0,dontknow,I thought about the story but chose not to use words associated with it. The words I came up with were just from my own thoughts.,5.0,4.0,4.0,5.0,4.0,1.0,1.0,1.0,The only change was realizing the introduction of the story that may influence the second word game.,USA,15:35,50-54,M,Right,Y,,Y,,White,1,N,4,10,N,,7.0,,,0.0,,1719775250513.0,1719775246122.0,1719775638151.0,1719775344679.0,1719775321290.0,1719775333200.0,1719775243966.0,1719776007447.0,1719776391815.0,1719776047550.0,1719775840740.0,1719776456584.0,1719775943623.0,1719775561360.0,1719775244089.0,1719775321289.0,1719775250513.0,1719775840740.0,1719775561360.0,1719775333199.0,1719775344679.0,1719775244087.0,1719776047549.0,1719776456583.0,1719776391743.0,1719775943622.0,1719776470999.0,1719776007445.0,1719775638151.0,1719775246121.0,70776.0,4391.0,202589.0,216681.0,11909.0,11479.0,121.0,40102.0,64768.0,344193.0,102882.0,14415.0,63822.0,76791.0,2032.0,1719775657283.0,1719775373079.0,1719775574308.0,1719775840740.0,1719775561360.0,1719775638151.0,63843.0,0.5388487657397634,19132.0,41295.0,41295.0,11762.33076923077,,0.0,0.0,0.0,0.0,0.0,0.0,0.0,0.0,0.0,0.0,0.0,0.0,0.0,0.0,0.0,1,0,7379.0
1044,True,True,True,True,4.0,1.0,1.0,7.0,1.0,6.0,7.0,4.0,6.0,3.0,3.0,1.0,1.0,1.0,4.0,6.0,46.0,50.0,36.0,0.5476190476190477,0.5494505494505495,0.5142857142857142,N,5.0,"Looking at things around me, or picking a word and thinking about words associated with it.",meaning,meaning,Not sure,A difference I felt playing the second word game was my first word choices had to do with lightness and things I remembered from the story,4.0,intentional,"I intentionally reflected on the story while playing the word chain game. I thought of words that reminded me of light. But after I thought of a few, my brain just started thinking of random words again.",4.0,2.0,3.0,5.0,3.0,1.0,1.0,1.0,I felt it was easier in the beginning of the second word game to come up with words since the story was fresh in my mind. It did not make me any more tired or bored though,USA,10:34,20-24,F,Right,Y,,Y,,Black,1,N,1,2,N,,7.0,,,936.0,,1719843579103.0,1719843574909.0,1719843883528.0,1719843606511.0,1719843583609.0,1719843591142.0,1719843572674.0,1719844194391.0,1719844490645.0,1719844214996.0,1719844070778.0,1719844533828.0,1719844148423.0,1719843804898.0,1719843572773.0,1719843583608.0,1719843579102.0,1719844070777.0,1719843804898.0,1719843591141.0,1719843606510.0,1719843572771.0,1719844214994.0,1719844533825.0,1719844490640.0,1719844148421.0,1719844544097.0,1719844194388.0,1719843883528.0,1719843574908.0,4505.0,4193.0,187249.0,198387.0,7532.0,15368.0,97.0,20603.0,43180.0,275644.0,77643.0,10269.0,45965.0,78630.0,2135.0,1719843889785.0,1719843623669.0,1719843817085.0,1719844070776.0,1719843804897.0,1719843883528.0,66443.0,0.6333369158771284,6257.0,7552.0,7552.0,2835.398825544409,,0.0,0.0,0.0,0.0,0.0,0.0,0.0,0.0,0.0,936.0,0.0,0.0,0.0,0.0,0.0,1,2,7838.0
1075,True,True,True,False,3.0,0.75,1.0,7.0,1.0,7.0,7.0,7.0,7.0,4.0,6.0,2.0,4.0,1.0,7.0,7.0,60.0,67.0,46.0,0.7142857142857143,0.7362637362637363,0.6571428571428571,N,5.0,looking around my office for things to bring up,sound,sound,not really sure to be honest,just started looking around the room to see what I could bring up that was similar to each other to keep it all going ,3.0,neither,I was trying to think about it but not really. Because I wanted my mind to be completely clear,4.0,1.0,1.0,6.0,3.0,7.0,4.0,1.0,Was just trying to pass the time. The last minute was very boring and hard to come up with words. ,USA,10:45,25-29,M,Right,Y,,Y,,White,1,Y,4,6,N,,7.0,,,60358.0,,1719941581008.0,1719941579545.0,1719941868235.0,1719941633475.0,1719941585432.0,1719941618677.0,1719941576680.0,1719942179353.0,1719942330954.0,1719942197175.0,1719942122316.0,1719942360057.0,1719942153463.0,1719941822612.0,1719941576878.0,1719941585431.0,1719941581007.0,1719942122315.0,1719941822611.0,1719941618677.0,1719941633475.0,1719941576877.0,1719942197174.0,1719942360056.0,1719942330952.0,1719942153462.0,1719942366356.0,1719942179352.0,1719941868235.0,1719941579545.0,4423.0,1462.0,254080.0,189136.0,33245.0,14798.0,197.0,17821.0,29102.0,133777.0,31146.0,6299.0,25889.0,45623.0,2667.0,1719941933783.0,1719941642421.0,1719941829601.0,1719942122315.0,1719941822611.0,1719941868235.0,38634.0,0.5761171450198165,65548.0,10904.0,10904.0,1729.3219587176109,,0.0,0.0,43221.0,0.0,3071.0,0.0,0.0,0.0,0.0,17137.0,0.0,0.0,0.0,0.0,0.0,1,2,5553.0
1045,True,True,True,False,3.0,0.75,1.0,7.0,1.0,7.0,7.0,7.0,7.0,2.0,3.0,2.0,3.0,1.0,3.0,7.0,50.0,57.0,40.0,0.5952380952380952,0.6263736263736264,0.5714285714285714,N,4.0,No strategy,none,none,To measure how effectively we comprehend and recall details after multitasking.,I felt like I came up with words faster after reading the story than before,5.0,dontknow,I am not entirely sure that the story was an influence on my words in the word chain game,4.0,2.0,2.0,3.0,7.0,2.0,1.0,6.0,I felt that after reading the story I came up with words very quickly and that were more diverse than the first round,USA,10:59,20-24,F,Right,Y,,Y,,Black,1,N,2,7,N,,7.0,,,0.0,,1719842674706.0,1719842669441.0,1719844425203.0,1719844094535.0,1719842728501.0,1719842735177.0,1719842666696.0,1719845075635.0,1719845964878.0,1719845269379.0,1719844637671.0,1719846013933.0,1719844753042.0,1719844309232.0,1719842666854.0,1719842728494.0,1719842674702.0,1719844637669.0,1719844309231.0,1719842735175.0,1719844094533.0,1719842666852.0,1719845269375.0,1719846013923.0,1719845964868.0,1719844753032.0,1719846023725.0,1719845075628.0,1719844425203.0,1719842669438.0,53788.0,5261.0,212466.0,214696.0,6674.0,1359356.0,156.0,193740.0,49045.0,695489.0,115361.0,9792.0,322586.0,115971.0,2584.0,1719844439589.0,1719844127205.0,1719844327642.0,1719844637669.0,1719844309231.0,1719844425203.0,97561.0,0.827160504314699,14386.0,88271.0,26257.0,7528.02534562212,,0.0,0.0,0.0,0.0,0.0,231334.0,0.0,0.0,0.0,0.0,0.0,0.0,0.0,0.0,0.0,1,0,31663.0
1046,True,True,True,True,4.0,1.0,1.0,7.0,7.0,7.0,7.0,1.0,7.0,7.0,7.0,7.0,7.0,7.0,7.0,7.0,84.0,85.0,70.0,1.0,0.9340659340659341,1.0,N,7.0,random,equal,equal,questionnaires overview,exciting,7.0,both,"while i was reflecting on the story while playing the word chain game, the aspects of the story came to mind unintentionally",7.0,7.0,7.0,7.0,7.0,7.0,7.0,7.0,exciting,USA,10:22,35-39,M,Right,Y,,Y,,Black,1,N,6,10,N,,7.0,,great study,7.0,,1719841369017.0,1719841359301.0,1719842397431.0,1719841903058.0,1719841485370.0,1719841684091.0,1719841343289.0,1719842973907.0,1719843590215.0,1719843193310.0,1719842699357.0,1719843833846.0,1719842890116.0,1719842164465.0,1719841350568.0,1719841485368.0,1719841369015.0,1719842699356.0,1719842164464.0,1719841684090.0,1719841903057.0,1719841350566.0,1719843193308.0,1719843833842.0,1719843590209.0,1719842890113.0,1719843868109.0,1719842973904.0,1719842397430.0,1719841359300.0,116351.0,9714.0,301925.0,261406.0,198720.0,218966.0,7277.0,219401.0,243627.0,396899.0,190756.0,34263.0,83788.0,232965.0,8732.0,1719842494368.0,1719841950812.0,1719842205180.0,1719842699356.0,1719842164464.0,1719842397430.0,192250.0,0.41656197504683584,96938.0,55258.0,53974.0,19189.64285714286,,92473.0,0.0,0.0,7.0,172837.0,149901.0,0.0,0.0,0.0,0.0,0.0,0.0,0.0,0.0,0.0,1,3,50227.0
1047,True,True,True,True,4.0,1.0,1.0,6.0,1.0,5.0,7.0,2.0,5.0,1.0,7.0,2.0,2.0,1.0,5.0,7.0,49.0,51.0,37.0,0.5833333333333334,0.5604395604395604,0.5285714285714286,N,4.0,"Whatever words popped into my mind, and with some words I thought of homophones.",meaning,sound,"I think it was trying to see if the words from the written story would pop up while typing random words. Or, if a person accidentally creates a sentence.","I think after I read the story, I tried hard not to use words that were in the story.",7.0,both,"After reading the story, I could not help but think of how lazy the protagonist was. I was thinking about the fact that he procrastinated for 7 years, for something that could have been fixed in 7 seconds.",6.0,4.0,3.0,5.0,1.0,1.0,1.0,6.0,"The main change I felt is that I went into the second word chain game annoyed. In the beginning, I thought about the fact that something so simple could have been easily fixed within seconds. That left me with a feeling of annoyance and agitation towards the main character.",USA,22:26,25-29,F,Right,Y,,Y,,Black,1,N,2,4,N,,7.0,,This was an interesting experiment. ,8522.0,,1719843045178.0,1719843030823.0,1719845966420.0,1719845455865.0,1719844242213.0,1719845336984.0,1719843024836.0,1719846719937.0,1719847579937.0,1719846779319.0,1719846203089.0,1719847656888.0,1719846603253.0,1719845684839.0,1719843025041.0,1719844242211.0,1719843045176.0,1719846203087.0,1719845684838.0,1719845336982.0,1719845455863.0,1719843025039.0,1719846779315.0,1719847656884.0,1719847579925.0,1719846603250.0,1719847700484.0,1719846719934.0,1719845966419.0,1719843030821.0,1197033.0,14353.0,236667.0,228973.0,1094769.0,118879.0,203.0,59378.0,76947.0,800606.0,400161.0,43596.0,116681.0,281580.0,5780.0,1719845995355.0,1719845496973.0,1719845796517.0,1719846203087.0,1719845684837.0,1719845966419.0,169902.0,0.459232831672404,28936.0,51600.0,43253.0,11429.688311688311,,0.0,2720.0,0.0,8522.0,166.0,0.0,0.0,0.0,0.0,0.0,0.0,0.0,0.0,0.0,3597.0,1,1,65164.0
1013,True,True,True,False,3.0,0.75,1.0,6.0,6.0,6.0,6.0,7.0,6.0,6.0,7.0,6.0,7.0,6.0,6.0,7.0,75.0,82.0,62.0,0.8928571428571429,0.9010989010989011,0.8857142857142857,N,7.0,I just let my mind roam,equal,equal,How we relate words to stories.,I thought more about the story.,5.0,unintentional,I just kept thinking about how relatable the story was. It was in my mind as I was thinking about other words. It came without issue.,4.0,4.0,3.0,4.0,4.0,3.0,2.0,2.0,I felt more annoyed than before reading the story. I was reminded of a time that something similar happened to me.,USA,12:30,35-39,F,Right,Y,,Y,,White,1,N,5,8,N,,7.0,,,163684.0,,1719775743437.0,1719775742458.0,1719775994445.0,1719775758362.0,1719775746927.0,1719775750488.0,1719775740420.0,1719776243327.0,1719776407057.0,1719776261678.0,1719776206462.0,1719776446544.0,1719776233215.0,1719775960670.0,1719775740571.0,1719775746925.0,1719775743436.0,1719776206461.0,1719775960669.0,1719775750488.0,1719775758361.0,1719775740570.0,1719776261677.0,1719776446542.0,1719776407054.0,1719776233213.0,1719776455048.0,1719776243326.0,1719775994444.0,1719775742457.0,3488.0,978.0,212016.0,202307.0,3561.0,7873.0,150.0,18350.0,39485.0,145376.0,26751.0,8504.0,10111.0,33774.0,1886.0,1719776002875.0,1719775767692.0,1719775967750.0,1719776206461.0,1719775960669.0,1719775994444.0,26694.0,0.8853603725619654,8431.0,52344.0,52344.0,3261.82084139265,,0.0,0.0,89819.0,17650.0,0.0,3058.0,0.0,0.0,0.0,56215.0,0.0,0.0,0.0,0.0,0.0,1,5,4391.0
1048,False,True,True,False,2.0,0.5,1.0,7.0,7.0,7.0,7.0,5.0,1.0,1.0,1.0,1.0,2.0,1.0,7.0,7.0,49.0,54.0,35.0,0.5833333333333334,0.5934065934065934,0.5,N,4.0,typed what was related to the original thought,none,meaning,measuring the association of words with other words,I had a theme to go off of and it changed my direction of thinking,7.0,intentional,I felt more inclined to go off the theme of the story and it was more difficult to come up with stuff,6.0,4.0,1.0,4.0,3.0,6.0,7.0,3.0,I felt a little more tired from the word game due to a lack of timer so I had no idea if I was stuck or not but it was enjoyable otherwise,USA,09:05,20-24,M,Right,Y,,Y,,Black,1,N,0,9,N,,7.0,,was kinda draining to do this survey,0.0,,1719841720170.0,1719841717372.0,1719842003315.0,1719841734663.0,1719841727164.0,1719841731234.0,1719841716211.0,1719842444153.0,1719842688342.0,1719842498589.0,1719842336269.0,1719842733075.0,1719842399301.0,1719841933661.0,1719841716327.0,1719841727163.0,1719841720170.0,1719842336269.0,1719841933661.0,1719841731233.0,1719841734663.0,1719841716327.0,1719842498589.0,1719842733074.0,1719842688340.0,1719842399300.0,1719842753375.0,1719842444152.0,1719842003315.0,1719841717371.0,6993.0,2798.0,332954.0,198998.0,4069.0,3429.0,116.0,54436.0,44732.0,189751.0,63031.0,20300.0,44851.0,69654.0,1044.0,1719842023455.0,1719841752493.0,1719841945831.0,1719842336268.0,1719841933661.0,1719842003315.0,57484.0,0.8350116098486012,20140.0,154122.0,154122.0,6356.862554112554,,0.0,0.0,0.0,0.0,0.0,0.0,0.0,0.0,1113.0,0.0,0.0,0.0,0.0,0.0,0.0,1,0,21992.0
1014,False,False,False,False,0.0,0.0,1.0,6.0,6.0,6.0,6.0,2.0,6.0,6.0,5.0,5.0,6.0,6.0,6.0,4.0,68.0,70.0,58.0,0.8095238095238095,0.7692307692307693,0.8285714285714286,N,6.0,memory word chain,equal,equal,measure your knowledge,i felt it in my mind,5.0,intentional,i loved it,6.0,6.0,6.0,3.0,3.0,6.0,2.0,3.0,i love the survey ,USA,15:42,35-39,M,Right,Y,,Y,,Black,1,N,5,5,N,,7.0,,,0.0,,1719775658008.0,1719775656223.0,1719776042543.0,1719775831074.0,1719775662292.0,1719775743556.0,1719775638817.0,1719776343397.0,1719776544331.0,1719776375472.0,1719776233958.0,1719776591697.0,1719776283827.0,1719776019326.0,1719775638966.0,1719775662288.0,1719775658004.0,1719776233953.0,1719776019324.0,1719775743553.0,1719775831072.0,1719775638963.0,1719776375465.0,1719776591687.0,1719776544312.0,1719776283820.0,1719776604845.0,1719776343391.0,1719776042541.0,1719775656216.0,4280.0,1781.0,191410.0,188250.0,81261.0,87516.0,146.0,32068.0,47356.0,168840.0,49862.0,13148.0,59564.0,23215.0,17250.0,1719776047607.0,1719775834217.0,1719776035793.0,1719776233953.0,1719776019322.0,1719776042541.0,6748.0,0.2603822147871576,5066.0,56281.0,56281.0,3457.501724137931,,0.0,0.0,0.0,0.0,69654.0,76034.0,0.0,0.0,0.0,0.0,0.0,0.0,0.0,0.0,0.0,1,0,2670.0
