1032,True,True,True,False,3.0,0.75,1.0,7.0,1.0,6.0,6.0,7.0,7.0,4.0,1.0,5.0,5.0,1.0,5.0,5.0,53.0,60.0,43.0,0.6309523809523809,0.6593406593406593,0.6142857142857143,N,7.0,Honestly after changing the bulb the 1st time i would have thought the fan light was broken too. Never would have occurred to me to check the remote ,equal,equal,"How ones brain will connect words to random words. Example if is say FArm, My bring will register farm animals such as a cow ","Before i was just typing random words that came to mind, After reading the story i began typing words linked to the story without noticing at first ",6.0,unintentional,After reading the story words that stood out from the story just popped in my head as i typed ,4.0,6.0,7.0,6.0,7.0,1.0,1.0,5.0,I was not bored reading the story. I was highly amused and found it funny ,USA,10:03,35-39,F,Right,Y,,Y,,MORE,1,N,1,8,N,,7.0,,,0.0,,1719841639476.0,1719841634621.0,1719841959259.0,1719841678852.0,1719841660541.0,1719841670004.0,1719841632000.0,1719842287459.0,1719842595453.0,1719842317788.0,1719842158355.0,1719842656595.0,1719842231955.0,1719841873988.0,1719841632141.0,1719841660539.0,1719841639475.0,1719842158353.0,1719841873987.0,1719841670003.0,1719841678851.0,1719841632140.0,1719842317786.0,1719842656592.0,1719842595449.0,1719842231953.0,1719842675112.0,1719842287457.0,1719841959258.0,1719841634620.0,21063.0,4854.0,199094.0,195135.0,9462.0,8847.0,140.0,30327.0,61139.0,277661.0,73598.0,18517.0,55502.0,85270.0,2479.0,1719841972915.0,1719841693588.0,1719841887756.0,1719842158353.0,1719841873986.0,1719841959258.0,71502.0,0.761679167364356,13657.0,9504.0,9504.0,3486.2733477011498,,0.0,0.0,0.0,0.0,0.0,0.0,0.0,0.0,0.0,0.0,0.0,0.0,0.0,0.0,0.0,1,0,8383.0
1033,True,True,True,True,4.0,1.0,1.0,7.0,1.0,7.0,7.0,7.0,7.0,4.0,4.0,1.0,3.0,1.0,7.0,7.0,56.0,63.0,42.0,0.6666666666666666,0.6923076923076923,0.6,N,7.0,Thinking of memories or every day life,meaning,meaning,Train of though,I felt more emotional afterward,4.0,unintentional,"I wasnt necessarily not trying to think of the story, but I wasnt actively thinking about it either, and it still would come to mind. ",4.0,2.0,5.0,5.0,7.0,2.0,2.0,5.0,"For some reason it was more difficult to come up with words after reading the story, maybe because it was more interesting or perhaps because I was subconsciously still thinking about it. ",USA,09:08,20-24,F,Right,Y,,Y,,NONE,1,N,1,6,N,,7.0,,,2266.0,,1719841430089.0,1719841424089.0,1719841737278.0,1719841456763.0,1719841438198.0,1719841446564.0,1719841417067.0,1719842080467.0,1719842393412.0,1719842110343.0,1719841957963.0,1719842974085.0,1719842034658.0,1719841674151.0,1719841417261.0,1719841438194.0,1719841430086.0,1719841957951.0,1719841674150.0,1719841446562.0,1719841456762.0,1719841417258.0,1719842110338.0,1719842974078.0,1719842393395.0,1719842034652.0,1719842986571.0,1719842080461.0,1719841737277.0,1719841424085.0,8105.0,5997.0,220673.0,217387.0,8364.0,10198.0,191.0,29871.0,580666.0,283052.0,76689.0,12486.0,45803.0,63126.0,6824.0,1719841770236.0,1719841477842.0,1719841683744.0,1719841957951.0,1719841674149.0,1719841737277.0,53533.0,0.8873276914958836,32959.0,27835.0,24580.0,5188.913742690059,,0.0,0.0,0.0,0.0,0.0,0.0,0.0,0.0,0.0,2266.0,0.0,0.0,0.0,0.0,0.0,1,5,6874.0
1010,True,True,True,False,3.0,0.75,1.0,7.0,1.0,5.0,5.0,3.0,4.0,1.0,6.0,2.0,2.0,1.0,2.0,4.0,40.0,43.0,34.0,0.47619047619047616,0.4725274725274725,0.4857142857142857,N,2.0,KISS method.  Keep it simple stupid.  ,equal,equal,I did answer all of the questions.,gave me more word ideas,2.0,neither,I didn't give it much thought.,2.0,2.0,1.0,2.0,3.0,3.0,4.0,3.0,no specific changes at all,USA,15:42,55-59,F,Right,Y,,Y,,White,1,N,5,6,N,,6.0,,It took me a second to realize how it worked.,0.0,,1719775526019.0,1719775518448.0,1719775967994.0,1719775645723.0,1719775622480.0,1719775634652.0,1719775514844.0,1719776333870.0,1719776554236.0,1719776372719.0,1719776164786.0,1719776626017.0,1719776246745.0,1719775848084.0,1719775515172.0,1719775622474.0,1719775526016.0,1719776164769.0,1719775848082.0,1719775634649.0,1719775645721.0,1719775515169.0,1719776372713.0,1719776626012.0,1719776554170.0,1719776246738.0,1719776656322.0,1719776333866.0,1719775967993.0,1719775518443.0,96455.0,7568.0,196775.0,202359.0,12169.0,11069.0,325.0,38843.0,71776.0,181451.0,81952.0,30305.0,87121.0,119909.0,3271.0,1719775984667.0,1719775665220.0,1719775869155.0,1719776164768.0,1719775848080.0,1719775967993.0,98838.0,0.8720941045873641,16674.0,10334.0,9206.0,3570.7453703703704,,0.0,0.0,0.0,0.0,0.0,0.0,0.0,0.0,0.0,0.0,0.0,0.0,0.0,0.0,0.0,1,0,41460.0
1011,True,True,False,True,3.0,0.75,1.0,7.0,3.0,7.0,7.0,4.0,7.0,2.0,2.0,2.0,6.0,1.0,5.0,5.0,54.0,58.0,44.0,0.6428571428571429,0.6373626373626373,0.6285714285714286,N,7.0,"I either associated a new word based on the word I just used (for example, I listed things at a cookout), or I used things around the room I am in for inspiration (keyboard, mouse, fan). ",meaning,meaning,I'm honestly not sure. Maybe how the words in the game were affected by the story we were told? ,"It felt much harder because I was trying not to repeat words, which made it harder because I had used most of the obvious ones the first time. I also used some of the words from the story the second time. ",5.0,both,"I was trying to remember aspects of the story to be able to answer these questions, but also the story was very funny and made me smile so I thought of it unintentionally. ",5.0,5.0,5.0,3.0,4.0,1.0,1.0,2.0,I just felt some frustration trying to come up with new words. No major change in emotion or experience. ,USA,15:39,35-39,M,Right,Y,,Y,,White,1,N,4,7,N,,7.0,,,0.0,,1719775562518.0,1719775559676.0,1719775865801.0,1719775618914.0,1719775600470.0,1719775608264.0,1719775558597.0,1719776152327.0,1719776363329.0,1719776175597.0,1719776058745.0,1719776398842.0,1719776107690.0,1719775811368.0,1719775558697.0,1719775600469.0,1719775562517.0,1719776058745.0,1719775811367.0,1719775608264.0,1719775618913.0,1719775558696.0,1719776175596.0,1719776398841.0,1719776363327.0,1719776107689.0,1719776410539.0,1719776152326.0,1719775865801.0,1719775559675.0,37951.0,2841.0,192944.0,192453.0,7794.0,10649.0,99.0,23269.0,35512.0,187730.0,48944.0,11697.0,44636.0,54433.0,978.0,1719775878433.0,1719775630875.0,1719775821706.0,1719776058744.0,1719775811367.0,1719775865801.0,44095.0,0.7243268316849835,12632.0,7226.0,4657.0,2081.177940400844,,0.0,0.0,0.0,0.0,0.0,0.0,0.0,0.0,0.0,0.0,0.0,0.0,0.0,0.0,0.0,1,0,7173.0
1069,True,True,True,True,4.0,1.0,1.0,6.0,6.0,6.0,7.0,2.0,5.0,4.0,5.0,2.0,2.0,2.0,5.0,6.0,56.0,58.0,45.0,0.6666666666666666,0.6373626373626373,0.6428571428571429,N,5.0,"I am unfamiliar with the ""word chain game"" so I am hoping I did it right. I just typed in what word came into my mind next, based on images I had going on, and looking at the keyboard and thinking of words that begin with whichever letter I decided to look at.",equal,sound,"If you write words that you have previously read , such as the ones in the story.","I felt like i had more words to choose from that weren't previously on my mind, after reading the story.",5.0,intentional,"I was still thinking about the story, and also looking at the keyboard and having words pop into my head.",5.0,3.0,5.0,5.0,6.0,2.0,3.0,4.0,"I didn't feel as much that I was pulling words out of my hat-mind, so much in the second game than I did in the first round. I had a vivd story I just read, so those images were still fresh in my mind, and came to me first.",USA,13:51,35-39,F,Right,Y,,Y,,White,0,N,2,5,N,,6.0,,,0.0,,1719941582152.0,1719941579775.0,1719941973026.0,1719941690658.0,1719941594642.0,1719941603339.0,1719941578476.0,1719942297171.0,1719942601054.0,1719942324208.0,1719942163245.0,1719942677258.0,1719942248779.0,1719941912647.0,1719941578610.0,1719941594641.0,1719941582148.0,1719942163244.0,1719941912646.0,1719941603338.0,1719941690657.0,1719941578608.0,1719942324207.0,1719942677254.0,1719942601050.0,1719942248777.0,1719942688982.0,1719942297169.0,1719941973026.0,1719941579774.0,12489.0,2373.0,190218.0,221988.0,8696.0,87318.0,132.0,27036.0,76200.0,276842.0,85532.0,11724.0,48390.0,60379.0,1164.0,1719941981950.0,1719941731046.0,1719941922961.0,1719942163243.0,1719941912646.0,1719941973026.0,50065.0,0.6310828408191971,8924.0,10685.0,10685.0,3635.2027777777776,,0.0,0.0,0.0,0.0,0.0,0.0,0.0,0.0,0.0,0.0,0.0,0.0,0.0,0.0,0.0,0,0,7099.0
1034,True,True,True,True,4.0,1.0,1.0,6.0,1.0,6.0,6.0,3.0,6.0,4.0,5.0,2.0,5.0,3.0,5.0,6.0,55.0,58.0,44.0,0.6547619047619048,0.6373626373626373,0.6285714285714286,N,6.0,I simply tried to remember the sequence of the story and tried to type out the words,meaning,equal,I think the experiment is trying to judge how one seems to think of words systematically on a normal day and after reading a story to see how much the story affects our choice of words,"After reading the story, most of the words i came up with were either directly from the story, or closely related to words from the story.",5.0,intentional,"I tried to reflect on the story to type out words from the story. Occasionally, i typed out other words that related to these words.",5.0,5.0,3.0,5.0,6.0,4.0,5.0,1.0,There was no other changes asides the one already mentioned,USA,09:01,25-29,M,Right,Y,,Y,,White,1,N,5,4,N,,6.0,,,0.0,,1719841208606.0,1719841203498.0,1719841588511.0,1719841279425.0,1719841247827.0,1719841256100.0,1719841199913.0,1719841940737.0,1719842487759.0,1719841972583.0,1719841794863.0,1719842576919.0,1719841862789.0,1719841509903.0,1719841200581.0,1719841247826.0,1719841208605.0,1719841794861.0,1719841509902.0,1719841256099.0,1719841279424.0,1719841200576.0,1719841972582.0,1719842576916.0,1719842487756.0,1719841862787.0,1719842589820.0,1719841940735.0,1719841588511.0,1719841203496.0,39220.0,5107.0,206350.0,230477.0,8272.0,23324.0,663.0,31845.0,89157.0,515173.0,67924.0,12901.0,77946.0,78608.0,2915.0,1719841599971.0,1719841327833.0,1719841527183.0,1719841794861.0,1719841509902.0,1719841588511.0,61328.0,0.3046161993672523,11460.0,38179.0,38179.0,4669.924814179531,,0.0,0.0,0.0,0.0,0.0,0.0,0.0,0.0,0.0,0.0,0.0,0.0,0.0,0.0,0.0,1,0,8754.0
1035,True,True,False,False,2.0,0.5,1.0,7.0,1.0,7.0,7.0,7.0,4.0,3.0,7.0,4.0,4.0,1.0,2.0,7.0,54.0,61.0,45.0,0.6428571428571429,0.6703296703296703,0.6428571428571429,N,4.0,Rhymes & story flow,sound,equal,Memory? No Idea,No differences,4.0,neither,The story had no bearing on the words I selected in the word game.,1.0,1.0,1.0,1.0,3.0,1.0,1.0,1.0,I felt no significant changes.,USA,06:50,30-34,M,Right,Y,,Y,,White,1,N,2,10,N,,7.0,,None. Thank you.,0.0,,1719840857659.0,1719840852932.0,1719841153364.0,1719840904751.0,1719840883792.0,1719840889786.0,1719840851247.0,1719841545774.0,1719841734172.0,1719841578528.0,1719841343186.0,1719841790668.0,1719841497518.0,1719841101172.0,1719840851395.0,1719840883791.0,1719840857658.0,1719841343184.0,1719841101171.0,1719840889785.0,1719840904751.0,1719840851393.0,1719841578526.0,1719841790666.0,1719841734168.0,1719841497517.0,1719841808802.0,1719841545772.0,1719841153363.0,1719840852930.0,26132.0,4726.0,189820.0,196420.0,5993.0,14965.0,146.0,32752.0,56494.0,155640.0,154331.0,18134.0,48254.0,52191.0,1535.0,1719841161565.0,1719840920753.0,1719841111238.0,1719841343184.0,1719841101170.0,1719841153363.0,42125.0,0.6924103946186146,8202.0,14602.0,14602.0,4281.021533613445,,0.0,0.0,0.0,0.0,0.0,0.0,0.0,0.0,0.0,0.0,0.0,0.0,0.0,0.0,0.0,1,0,4234.0
1036,False,True,True,False,2.0,0.5,1.0,7.0,4.0,7.0,5.0,5.0,5.0,1.0,6.0,4.0,4.0,1.0,7.0,7.0,58.0,63.0,44.0,0.6904761904761905,0.6923076923076923,0.6285714285714286,N,5.0,"At first, I was using words that made sense to each other as it went on.",none,meaning,How quickly to come up with different words that doesn't repeat,Only difference is that before I created a story but after I went the random route,4.0,neither,I was coming up with words that relate to each other. The story beforehand didn't really factor into how I played the word game after reading the story.,3.0,1.0,2.0,4.0,1.0,1.0,2.0,5.0,The experience felt pretty straightforward. I enjoyed the word chaining game. I didn't feel any specific change outside of the changing the strategy of putting together a story before hand and then going random the second time.,USA,10:19,35-39,M,Right,Y,,Y,,Black,1,N,3,8,N,,7.0,,,0.0,,1719842450922.0,1719842448730.0,1719842776375.0,1719842513744.0,1719842454970.0,1719842459538.0,1719842447522.0,1719843146405.0,1719843471683.0,1719843179443.0,1719842978858.0,1719843523937.0,1719843091902.0,1719842707578.0,1719842447619.0,1719842454969.0,1719842450921.0,1719842978857.0,1719842707578.0,1719842459537.0,1719842513743.0,1719842447619.0,1719843179443.0,1719843523936.0,1719843471682.0,1719843091901.0,1719843532568.0,1719843146404.0,1719842776375.0,1719842448729.0,4047.0,2191.0,202482.0,193834.0,4567.0,54205.0,97.0,33038.0,52253.0,292239.0,113043.0,8631.0,54502.0,68797.0,1110.0,1719842796918.0,1719842527295.0,1719842719649.0,1719842978857.0,1719842707578.0,1719842776375.0,56726.0,0.8354485236022778,20543.0,11344.0,8487.0,3222.7805944055945,,0.0,0.0,0.0,0.0,0.0,0.0,0.0,0.0,0.0,0.0,0.0,0.0,0.0,0.0,0.0,1,0,6521.0
1070,False,True,True,True,3.0,0.75,1.0,7.0,7.0,7.0,7.0,6.0,7.0,5.0,6.0,1.0,2.0,1.0,3.0,7.0,60.0,66.0,50.0,0.7142857142857143,0.7252747252747253,0.7142857142857143,N,4.0,I tried to think of other words that were related to the last word or perhaps used similar letters. I also looked around my room to get inspiration to start a different word chain.,meaning,meaning,My guess is it has something to do with short term memory.,I felt that it was harder to come up with words because I had already exhausted most of my immediate surroundings that I was using to start word chains.,3.0,unintentional,"When I was trying to think of a word, lingering in the back of my head was the story. I thought it a bit funny and I could see the man and the light, though they weren't very vivid just an outline. Thinking back, the story may have made me perform less well on the second word chain game.",5.0,2.0,5.0,5.0,7.0,1.0,1.0,1.0,"Like I said in my previous response, I found it more difficult to focus on coming up with a word to use. I think I started with lights and dim, but after a bit I was drawing blanks. I think the story may have lingered in my mind and distracted me a bit, but I wouldn't say I was tired or bored due to the story.",USA,13:26,25-29,M,Right,Y,,Y,,White,1,N,2,7,N,,7.0,,,0.0,,1719943625444.0,1719943621035.0,1719943921694.0,1719943669487.0,1719943640909.0,1719943656619.0,1719943619558.0,1719944308074.0,1719944784752.0,1719944351791.0,1719944109909.0,1719944839063.0,1719944261369.0,1719943869814.0,1719943620102.0,1719943640909.0,1719943625443.0,1719944109908.0,1719943869814.0,1719943656619.0,1719943669487.0,1719943620102.0,1719944351790.0,1719944839063.0,1719944784731.0,1719944261369.0,1719944850089.0,1719944308073.0,1719943921694.0,1719943621035.0,15465.0,4408.0,188214.0,200327.0,15710.0,12868.0,544.0,43716.0,54311.0,432940.0,151460.0,11026.0,46704.0,51880.0,933.0,1719943928442.0,1719943688065.0,1719943875717.0,1719944109908.0,1719943869814.0,1719943921694.0,45977.0,0.7377438548774528,6748.0,6696.0,6215.0,2684.734724940204,,0.0,0.0,0.0,0.0,0.0,0.0,0.0,0.0,0.0,0.0,0.0,0.0,0.0,0.0,0.0,1,0,5040.0
1037,True,True,True,True,4.0,1.0,1.0,6.0,1.0,7.0,7.0,3.0,3.0,5.0,5.0,2.0,5.0,5.0,6.0,6.0,58.0,61.0,46.0,0.6904761904761905,0.6703296703296703,0.6571428571428571,N,6.0,"I focused on words that had common ending like ""e"", ""n"", and ""t"" which provided more options for the next word, making it easier to continue the chain. I also used everyday common words.",meaning,meaning,The experiment aimed to measure participants' ability to maintain a chain of related words while employing strategies such as anticipating common endings and simplifying word choices.,"Before reading the story, playing the word chain game was more focused on maintaining a sequence of words without specific context. After reading the story, there was a heightened awareness of the importance of paying attention to details and avoiding assumptions, as highlighted by the oversight with the dimmable light bulb. This led to a more strategic approach in selecting words that could relate to everyday situations and potential oversights, enhancing the depth and relevance of the game.",5.0,unintentional,"The story came to mind intentionally while playing the word chain game because it illustrated how a simple oversight (the dimmable light setting) had significant consequences on daily life. This made me more mindful of how small details and overlooked factors can impact outcomes, including in the context of choosing words that fit into a sequence. It prompted me to consider the broader implications of oversight and attention to detail, enriching the game experience with a deeper level of strategic thinking.",5.0,4.0,5.0,5.0,5.0,2.0,2.0,2.0,"Reading the story about the dimmable light bulb highlighted the impact of small oversights on daily life, prompting greater awareness of attention to detail. This awareness influenced my approach to activities like playing the word chain game, where I became more mindful of selecting words that related to practical scenarios and considering the broader implications of oversight.",USA,07:47,25-29,M,Right,Y,,Y,,Black,1,N,4,6,N,,7.0,,,31491.0,,1719842341884.0,1719842339596.0,1719842848549.0,1719842391370.0,1719842348956.0,1719842363542.0,1719842335899.0,1719843846213.0,1719845149286.0,1719844029822.0,1719843247122.0,1719845324540.0,1719843586428.0,1719842664230.0,1719842336556.0,1719842348955.0,1719842341883.0,1719843247120.0,1719842664230.0,1719842363541.0,1719842391369.0,1719842336554.0,1719844029820.0,1719845324537.0,1719845149281.0,1719843586424.0,1719845355668.0,1719843846211.0,1719842848549.0,1719842339594.0,7071.0,2287.0,398571.0,272860.0,14585.0,27827.0,655.0,183607.0,175251.0,1119459.0,339302.0,31128.0,259783.0,184319.0,3038.0,1719843063540.0,1719842477823.0,1719842698390.0,1719843247120.0,1719842664229.0,1719842848549.0,150159.0,0.7163104591728435,214991.0,27501.0,19279.0,6412.166069295101,,0.0,0.0,0.0,0.0,0.0,0.0,0.0,0.0,0.0,22032.0,0.0,0.0,9459.0,0.0,0.0,1,8,43118.0
1038,True,True,True,True,4.0,1.0,1.0,7.0,1.0,7.0,7.0,4.0,7.0,2.0,7.0,1.0,5.0,1.0,2.0,6.0,53.0,57.0,45.0,0.6309523809523809,0.6263736263736264,0.6428571428571429,N,7.0,I was thinking about relevant things happening in my life. We recently bought a home so I was almost summing up our experiences in a few keywords. I was also just letting my mind wander and writing out the first things that came to my head.,meaning,meaning,"I'm not sure, maybe how to target people to read a longer story using relevant key terms.",It was easier to start the word chain game after reading the story because I had a topic to go off of. ,6.0,intentional,"To start off the second word chain game, I was reflecting on the story and using some keywords in the gam. I eventually let myself wander down a tangent that was irrelevant to the story based on what I could just think of on the spot.",4.0,2.0,2.0,7.0,5.0,1.0,1.0,5.0,"I did feel like the second word game was easier because I had an interesting story in my mind to give me a starting topic. The first game, I felt thrown in with little to no instruction and felt I had to be creative. It was harder to start the first game than the second so anxiety was a bit higher the first time around.",USA,10:23,25-29,F,Right,Y,,Y,,White,1,N,5,9,N,,7.0,,,0.0,,1719842774971.0,1719842769005.0,1719843116401.0,1719842801684.0,1719842779253.0,1719842784724.0,1719842767757.0,1719843425522.0,1719843775178.0,1719843451770.0,1719843314225.0,1719843820260.0,1719843378680.0,1719843022027.0,1719842767818.0,1719842779251.0,1719842774970.0,1719843314223.0,1719843022026.0,1719842784723.0,1719842801683.0,1719842767817.0,1719843451769.0,1719843820256.0,1719843775175.0,1719843378679.0,1719843828932.0,1719843425519.0,1719843116401.0,1719842769003.0,4280.0,5965.0,197822.0,220342.0,5470.0,16959.0,60.0,26247.0,45078.0,323405.0,64454.0,8672.0,46839.0,94374.0,1185.0,1719843133337.0,1719842839126.0,1719843067757.0,1719843314223.0,1719843022025.0,1719843116401.0,48644.0,0.8613398099650836,16936.0,5726.0,5726.0,2685.381902502157,,0.0,0.0,0.0,0.0,0.0,0.0,0.0,0.0,0.0,0.0,0.0,0.0,0.0,0.0,0.0,1,0,6528.0
1071,True,True,True,False,3.0,0.75,1.0,7.0,1.0,7.0,7.0,4.0,7.0,2.0,5.0,1.0,2.0,1.0,4.0,7.0,51.0,55.0,40.0,0.6071428571428571,0.6043956043956044,0.5714285714285714,N,7.0,"If I thought of one word, there was typically multiple words that followed that were similar or went with it. Such as tree and leaf, or milk and tea. I created word pairs, but that was naturally where my mind went in the moment.",meaning,meaning,"If after reading a passage that causes some level of emotional connection or interest, will the related words impact thought patterns. ","It didn't feel particularly different, but I think I may have been unknowingly remembering the words from the story. I do remember thinking of light and a couple. ",3.0,unintentional,"When playing the word chain game, I was focused on the task at hand mentally. So, I wasn't intentionally thinking of the story before or any words that were present in it. I would imagine that it did impact the words I thought of but I think the words in the second round were similar to the first round for me. It was already easy to think of and reuse those words as I had just done so. ",2.0,6.0,5.0,2.0,1.0,2.0,1.0,1.0,"I found the story funny so that lightened my mood and I think made it easier to actively engage with thinking of words. I didn't notice the word game being easier, it felt about the same in terms of ease of thinking up words. I wasn't bored either round as it was interesting seeing what word I'd think up next and the game itself was engaging. ",USA,12:56,25-29,F,Right,Y,,Y,,White,1,N,4,5,N,,7.0,,,792.0,,1719941592693.0,1719941588819.0,1719942099932.0,1719941825478.0,1719941786589.0,1719941800111.0,1719941587290.0,1719942390681.0,1719942956441.0,1719942423490.0,1719942293097.0,1719943004247.0,1719942336602.0,1719942024972.0,1719941587381.0,1719941786588.0,1719941592692.0,1719942293096.0,1719942024972.0,1719941800111.0,1719941825478.0,1719941587381.0,1719942423489.0,1719943004246.0,1719942956439.0,1719942336601.0,1719943020073.0,1719942390680.0,1719942099932.0,1719941588818.0,193895.0,3873.0,193164.0,199494.0,13522.0,25367.0,91.0,32808.0,47805.0,532949.0,43504.0,15826.0,54078.0,74960.0,1437.0,1719942111683.0,1719941844166.0,1719942040897.0,1719942293096.0,1719942024972.0,1719942099932.0,59035.0,0.6826351850067212,11751.0,7521.0,4181.0,2305.258340048348,,42341.0,0.0,0.0,792.0,0.0,14766.0,0.0,0.0,0.0,0.0,0.0,0.0,0.0,0.0,0.0,1,1,6947.0
1072,True,True,True,True,4.0,1.0,1.0,7.0,7.0,7.0,7.0,7.0,7.0,1.0,4.0,1.0,5.0,1.0,2.0,5.0,54.0,61.0,47.0,0.6428571428571429,0.6703296703296703,0.6714285714285714,N,7.0,I tried to think of the show that used to be on air about word chains,equal,equal,Our memories,I felt no difference,5.0,neither,The story i read did not relate to the word chain game to me,1.0,1.0,1.0,1.0,3.0,1.0,1.0,1.0,"I did not feel ay changes. I took it as separate, unrelated tasks basically. ",USA,13:48,25-29,M,Right,Y,,Y,,White,1,N,5,5,N,,7.0,,,10982.0,,1719941599779.0,1719941597495.0,1719941954094.0,1719941616485.0,1719941603280.0,1719941608764.0,1719941591884.0,1719942292355.0,1719942479151.0,1719942314994.0,1719942176887.0,1719942575471.0,1719942252370.0,1719941885119.0,1719941593553.0,1719941603279.0,1719941599778.0,1719942176886.0,1719941885118.0,1719941608763.0,1719941616484.0,1719941593552.0,1719942314992.0,1719942575469.0,1719942479149.0,1719942252369.0,1719942584629.0,1719942292353.0,1719941954094.0,1719941597494.0,3500.0,2283.0,222792.0,268633.0,5483.0,7720.0,1668.0,22637.0,96318.0,164155.0,75482.0,9158.0,39983.0,68975.0,3941.0,1719941971466.0,1719941633295.0,1719941901096.0,1719942176886.0,1719941885118.0,1719941954094.0,52998.0,0.6732277330622278,17372.0,133331.0,32715.0,10944.916666666666,,0.0,0.0,0.0,1825.0,0.0,0.0,0.0,0.0,41240.0,9157.0,0.0,0.0,0.0,0.0,0.0,1,2,5276.0
1039,True,False,False,False,1.0,0.25,1.0,7.0,7.0,6.0,7.0,6.0,6.0,4.0,4.0,1.0,4.0,1.0,1.0,7.0,55.0,61.0,47.0,0.6547619047619048,0.6703296703296703,0.6714285714285714,N,5.0,Most of my words were associated with places I find myself regularly or related to previous words.,meaning,meaning,Connectiveness of different kinds of ideas.,The story seemingly began my second set of word choices because the ideas form the story were still in mind.,6.0,intentional,I started out with ideas from the story then eventually ran out of words. From there I am not sure where the words came to mind.,7.0,1.0,1.0,7.0,7.0,1.0,1.0,1.0,I felt like I had rerun the story in my mind and that I should move on. I was not particularly glad or sad about running out of words from the story. I did slow down in transitioning to new words not associated with the story.,USA,09:17,30-34,M,Right,Y,,Y,,White,1,N,2,5,N,,7.0,,,0.0,,1719842366372.0,1719842365137.0,1719842689396.0,1719842441926.0,1719842421807.0,1719842429682.0,1719842363465.0,1719842989695.0,1719843422759.0,1719843009582.0,1719842876045.0,1719843464298.0,1719842942967.0,1719842631577.0,1719842363565.0,1719842421806.0,1719842366371.0,1719842876044.0,1719842631577.0,1719842429682.0,1719842441926.0,1719842363564.0,1719843009582.0,1719843464297.0,1719843422757.0,1719842942966.0,1719843493280.0,1719842989694.0,1719842689396.0,1719842365136.0,55434.0,1234.0,186648.0,189651.0,7875.0,12244.0,99.0,19887.0,41538.0,413175.0,66921.0,28982.0,46727.0,57819.0,1571.0,1719842695897.0,1719842451550.0,1719842640015.0,1719842876044.0,1719842631576.0,1719842689396.0,49381.0,0.7024583685629988,6501.0,8736.0,8736.0,3317.6857674104126,,0.0,0.0,0.0,0.0,0.0,0.0,0.0,0.0,0.0,0.0,0.0,0.0,0.0,0.0,0.0,1,0,7583.0
